Menu,Matertial
ต้มยำกุ้ง,กุ้งสด น้ำมะนาว น้ำปลา น้ำตาลปี๊บ พริกขี้หนูสวน  ตะไคร้ ใบมะกรูด ข่าแก่ หอมแดง เกลือป่น
แกงเขียวหวาน,ไก่ หมู วัว เห็ด ปลาใบโหระพา ใบมะกรูด น้ำมะนาว น้ำปลา น้ำตาลปี๊บ พริกแกงเขียวหวานสำเร็จรูป กะทิ  น้ำมันพืช
ผัดไทย,เส้นจันท์  กุ้งสด ไข่ไก่  ถั่วลิสงคั่ว น้ำมะนาว  น้ำปลา น้ำตาลปี๊บ ซอสปรุงรส  พริกขี้หนูซอย หอมแดงซอย ต้นหอมซอย ถั่วงอก  น้ำมันพืช
แกงกระหรี่,ไก่ หมู วัว เห็ด ปลา กรัม หัวหอมใหญ่ แครอท ถั่วแขก  กะทิ  แกงกะหรี่สำเร็จรูป  นมสด  เกลือป่น พริกไทยดำป่น
ส้มตำ,มะละกอดิบ มะเขือเทศ ถั่วฝักยาว กระเทียม  มะนาว น้ำปลา น้ำตาลปี๊บ น้ำปลาร้าต้มสุก พริกขี้หนูสวน  ข้าวคั่ว  ใบสะระแหน่  ถั่วลิสงคั่ว 
ข้าวเหนียวมะม่วง,ข้าวเหนียวใหม่  กะทิ  น้ำตาลปี๊บ  เกลือป่น มะม่วงสุก
ก๊วยเตี๋ยว,เส้น ไก่ หมู วัว ปลา ถั่วงอก คะน้า ผักกาดขาว น้ำปลา น้ำตาลปี๊บ พริกป่น 
ขนมจีน,ขนมจีน ถั่วงอก ผักกาดขาว ผักบุ้ง เป็นต้น น้ำพริกเผา น้ำพริกหนุ่ม ถั่วลิสงคั่ว ปลา
